<?xml version="1.0" encoding="utf-8" ?>
<?xml-stylesheet type="text/xsl" href="Cart.xsl"?>
<cart xmlns:xsi="http://www.w3.org/2001/XMLSchema-instance"
        xsi:noNamespaceSchemaLocation="Cart.xsd">
    <Customer>
        <name>Duy code</name>
        <address>Long Biên- Hà Nội</address>
        <tel>0987654321</tel>
    </Customer>
    <GrandTotal>1000000</GrandTotal>
    <Date>2019-11-29</Date>
    <Items>
        <Item>
            <nameItem>Duy code</nameItem>
            <priceItem>50</priceItem>
            <quantityItem>20</quantityItem>
            <subTotal>10</subTotal>
        </Item>
        <Item>
            <nameItem>Vũ code</nameItem>
            <priceItem>10</priceItem>
            <quantityItem>3</quantityItem>
            <subTotal>20</subTotal>
        </Item>
    </Items>
</cart>